{
  "$schema": "../schemas/interface-contract-v3.schema.json",
  "$id": "https://physicistjohn.github.io/tinysa-flasher/contracts/interfaces/legacy-migration-v3.json",
  "contractId": "tinysa-flasher-legacy-migration",
  "contractVersion": 3,
  "envelopeVersion": 3,
  "previousContract": {
    "path": "./legacy-migration-v1.json",
    "contractVersion": 1,
    "sha256": "fcfa586d298d7633991ea4653d3693689137cbb4243908aad2f1b7d7c5f049c5"
  },
  "kind": "migration",
  "owner": "firmware-transaction-evidence",
  "provider": "migrateLegacyFirmwareState",
  "consumers": [
    "application startup"
  ],
  "compatibility": "exact-version",
  "typeDefinitions": {
    "LegacyEvidenceLocations": {
      "sourceModule": "src/core/legacy-migration.ts",
      "platformType": "{ targetDirectory: string; legacyDirectories: readonly string[] }"
    },
    "LegacyMigrationResult": {
      "sourceModule": "src/core/legacy-migration.ts",
      "typeExport": "LegacyMigrationResult",
      "sourceSignature": "export interface LegacyMigrationResult { status: 'none' | 'imported' | 'already-current' | 'conflict'; sources: readonly string[]; message?: string; }"
    }
  },
  "invocations": [
    {
      "capabilityId": "import-once",
      "sourceModule": "src/core/legacy-migration.ts",
      "symbol": "migrateLegacyFirmwareState",
      "symbolKind": "function",
      "sourceMember": "migrateLegacyFirmwareState",
      "sourceSignature": "migrateLegacyFirmwareState(targetDirectory: string, legacyDirectories: readonly string[]): Promise<LegacyMigrationResult>",
      "argumentsSignature": "readonly [targetDirectory: string, legacyDirectories: readonly string[]]",
      "returnSignature": "Promise<LegacyMigrationResult>",
      "inputDescription": "Standalone target and the two known Atomizer firmware directories.",
      "outputDescription": "Discriminated none, imported, already-current, or conflict result.",
      "errors": [
        {
          "code": "LEGACY_EVIDENCE_CONFLICT",
          "retryability": "manual-inspection",
          "description": "Histories differ, are malformed, drifted, locked, or structurally unsafe."
        }
      ],
      "invariants": [
        "Sources are never deleted or selected by recency.",
        "Identical evidence is copied create-once and a durable consumed-hash marker prevents resurrection."
      ],
      "validationBoundary": "src/core/legacy-migration.ts#migrateLegacyFirmwareState.migrateLegacyFirmwareState owns the exact declared call boundary; referenced runtime validators apply before untrusted values are used.",
      "tests": [
        "tests/legacy-migration.test.ts"
      ]
    }
  ],
  "structuralCapabilities": [],
  "compositions": [],
  "sourceOfTruth": [
    "src/core/legacy-migration.ts",
    "src/core/persistence/evidence-schemas-v1.ts",
    "src/core/persistence/evidence-layout.ts"
  ]
}
