{
  "$schema": "../schemas/interface-contract-v3.schema.json",
  "$id": "https://physicistjohn.github.io/tinysa-flasher/contracts/interfaces/application-config-v3.json",
  "contractId": "tinysa-flasher-application-config",
  "contractVersion": 3,
  "envelopeVersion": 3,
  "previousContract": {
    "path": "./application-config-v1.json",
    "contractVersion": 1,
    "sha256": "388409d8df4e71953b8dae06e0e9a22cad2bb556f2aca6fa5b2dc3f7a26afa3e"
  },
  "kind": "configuration",
  "owner": "desktop-composition-root",
  "provider": "process environment and Electron packaging state",
  "consumers": [
    "renderer loader",
    "DFU tool discovery"
  ],
  "compatibility": "exact-version",
  "typeDefinitions": {
    "VITE_DEV_SERVER_URL? and isPackaged": {
      "sourceModule": "src/main/config.ts",
      "valueExport": "loadApplicationConfig",
      "platformType": "{ VITE_DEV_SERVER_URL?: string; isPackaged: boolean }"
    },
    "RendererTrust": {
      "sourceModule": "src/main/security.ts",
      "typeExport": "RendererTrust",
      "sourceSignature": "export type RendererTrust = | { mode: 'development'; origin: string } | { mode: 'production'; url: string };"
    },
    "TINYSA_DFU_UTIL? and PATH": {
      "sourceModule": "src/main/config.ts",
      "valueExport": "loadApplicationConfig",
      "platformType": "{ TINYSA_DFU_UTIL?: string; PATH?: string }"
    },
    "DfuToolConfiguration": {
      "sourceModule": "src/main/config.ts",
      "typeExport": "ApplicationConfig",
      "sourceSignature": "export interface ApplicationConfig { readonly developmentServerUrl?: URL; readonly dfuUtilPath?: string; readonly executableSearchPath: string; }"
    }
  },
  "invocations": [
    {
      "capabilityId": "load-application-config",
      "sourceModule": "src/main/config.ts",
      "symbol": "loadApplicationConfig",
      "symbolKind": "function",
      "sourceMember": "loadApplicationConfig",
      "sourceSignature": "loadApplicationConfig(environment: NodeJS.ProcessEnv, isPackaged: boolean): ApplicationConfig",
      "argumentsSignature": "readonly [environment: NodeJS.ProcessEnv, isPackaged: boolean]",
      "returnSignature": "ApplicationConfig",
      "inputDescription": "Process environment and authoritative Electron packaging state.",
      "outputDescription": "One normalized ApplicationConfig for renderer location and dfu-util discovery.",
      "errors": [
        {
          "code": "INVALID_APPLICATION_CONFIG",
          "retryability": "never",
          "description": "The supported environment shape, development URL, or explicit absolute dfu-util path is invalid."
        }
      ],
      "invariants": [
        "Packaged applications ignore development-server overrides.",
        "An explicit dfu-util override is retained only as an absolute path and never bypasses exact version admission."
      ],
      "validationBoundary": "src/main/config.ts#loadApplicationConfig.loadApplicationConfig owns the exact declared call boundary; referenced runtime validators apply before untrusted values are used.",
      "tests": [
        "tests/config.test.ts",
        "tests/security.test.ts"
      ]
    },
    {
      "capabilityId": "validate-development-server-url",
      "sourceModule": "src/main/security.ts",
      "symbol": "validateDevelopmentServerUrl",
      "symbolKind": "function",
      "sourceMember": "validateDevelopmentServerUrl",
      "sourceSignature": "validateDevelopmentServerUrl(value: string): URL",
      "argumentsSignature": "readonly [value: string]",
      "returnSignature": "URL",
      "inputDescription": "One untrusted development-server URL string.",
      "outputDescription": "The exact admitted loopback HTTP URL.",
      "errors": [
        {
          "code": "INVALID_APPLICATION_CONFIG",
          "retryability": "never",
          "description": "The configured development URL is not unauthenticated local HTTP."
        }
      ],
      "invariants": [
        "Only unauthenticated HTTP URLs on localhost, 127.0.0.1, or [::1] are admitted."
      ],
      "validationBoundary": "src/main/security.ts#validateDevelopmentServerUrl.validateDevelopmentServerUrl owns the exact declared call boundary; referenced runtime validators apply before untrusted values are used.",
      "tests": [
        "tests/config.test.ts",
        "tests/security.test.ts"
      ]
    },
    {
      "capabilityId": "select-development-server-url",
      "sourceModule": "src/main/security.ts",
      "symbol": "selectDevelopmentServerUrl",
      "symbolKind": "function",
      "sourceMember": "selectDevelopmentServerUrl",
      "sourceSignature": "selectDevelopmentServerUrl(value: string | undefined, isPackaged: boolean): URL | undefined",
      "argumentsSignature": "readonly [value: string | undefined, isPackaged: boolean]",
      "returnSignature": "URL | undefined",
      "inputDescription": "Optional development URL plus authoritative packaging state.",
      "outputDescription": "The admitted development URL, or absence for packaged/file rendering.",
      "errors": [
        {
          "code": "INVALID_APPLICATION_CONFIG",
          "retryability": "never",
          "description": "The configured development URL is not unauthenticated local HTTP."
        }
      ],
      "invariants": [
        "Packaged applications and absent values return undefined without parsing the override.",
        "An unpackaged nonempty value is accepted only through validateDevelopmentServerUrl."
      ],
      "validationBoundary": "src/main/security.ts#selectDevelopmentServerUrl.selectDevelopmentServerUrl owns the exact declared call boundary; referenced runtime validators apply before untrusted values are used.",
      "tests": [
        "tests/config.test.ts",
        "tests/security.test.ts"
      ]
    },
    {
      "capabilityId": "is-trusted-renderer-url",
      "sourceModule": "src/main/security.ts",
      "symbol": "isTrustedRendererUrl",
      "symbolKind": "function",
      "sourceMember": "isTrustedRendererUrl",
      "sourceSignature": "isTrustedRendererUrl(actual: string, expected: RendererTrust | undefined): boolean",
      "argumentsSignature": "readonly [actual: string, expected: RendererTrust | undefined]",
      "returnSignature": "boolean",
      "inputDescription": "Actual frame URL and the exact expected renderer trust variant.",
      "outputDescription": "Whether the frame URL exactly satisfies the selected trust boundary.",
      "errors": [],
      "invariants": [
        "Undefined expectations and malformed actual URLs return false.",
        "Development trust requires exact origin equality; production trust requires exact URL equality."
      ],
      "validationBoundary": "src/main/security.ts#isTrustedRendererUrl.isTrustedRendererUrl owns the exact declared call boundary; referenced runtime validators apply before untrusted values are used.",
      "tests": [
        "tests/config.test.ts",
        "tests/security.test.ts"
      ]
    }
  ],
  "structuralCapabilities": [],
  "compositions": [],
  "sourceOfTruth": [
    "src/main/config.ts",
    "src/main/security.ts",
    "src/main/main.ts",
    "src/dfu/dfu-util.ts"
  ]
}
