{
  "$schema": "../schemas/interface-contract-v3.schema.json",
  "$id": "https://physicistjohn.github.io/tinysa-flasher/contracts/interfaces/local-firmware-picker-v3.json",
  "contractId": "tinysa-flasher-local-firmware-picker",
  "contractVersion": 3,
  "envelopeVersion": 3,
  "previousContract": {
    "path": "./local-firmware-picker-v1.json",
    "contractVersion": 1,
    "sha256": "1f934e51c10c8f98e01eb5b79a705bed7ca38a134f9f78dc56014a620158d02e"
  },
  "kind": "runtime-port",
  "owner": "desktop-composition-root",
  "provider": "LocalFirmwareTargetPicker",
  "consumers": [
    "FlasherApplication"
  ],
  "compatibility": "exact-version",
  "typeDefinitions": {
    "LocalFirmwareTargetPicker": {
      "sourceModule": "src/main/local-firmware-target-picker.ts",
      "typeExport": "LocalFirmwareTargetPicker",
      "sourceSignature": "class LocalFirmwareTargetPicker { selectLocalFirmwareTarget(): Promise<LocalFirmwareTargetSelection | undefined>; reopenLocalFirmwareTarget(target: LocalCustomFirmwareTarget): Promise<LocalFirmwareTargetSelection> }"
    },
    "LocalFirmwareManifestDialog": {
      "sourceModule": "src/main/local-firmware-target-picker.ts",
      "typeExport": "LocalFirmwareManifestDialog",
      "sourceSignature": "export interface LocalFirmwareManifestDialog { chooseManifest(parent: BrowserWindow | undefined): Promise<string | undefined>; }"
    },
    "ManifestPathOrUndefined": {
      "sourceModule": "platform:node",
      "platformType": "string | undefined"
    },
    "LocalFirmwareTargetSelection": {
      "sourceModule": "src/application/flasher-application.ts",
      "typeExport": "LocalFirmwareTargetSelection",
      "sourceSignature": "export interface LocalFirmwareTargetSelection { readonly target: LocalCustomFirmwareTarget; readonly artifact: AdmittedFirmwareArtifact; }"
    },
    "LocalCustomFirmwareTarget": {
      "sourceModule": "src/core/contracts.ts",
      "runtimeValidator": "localCustomFirmwareTargetSchema",
      "typeExport": "LocalCustomFirmwareTarget",
      "sourceSignature": "export type LocalCustomFirmwareTarget = z.infer<typeof localCustomFirmwareTargetSchema>;"
    }
  },
  "invocations": [
    {
      "capabilityId": "dialog-choose-manifest",
      "sourceModule": "src/main/local-firmware-target-picker.ts",
      "symbol": "LocalFirmwareManifestDialog",
      "symbolKind": "interface",
      "sourceMember": "chooseManifest",
      "sourceSignature": "chooseManifest(parent: BrowserWindow | undefined): Promise<string | undefined>",
      "argumentsSignature": "readonly [parent: BrowserWindow | undefined]",
      "returnSignature": "Promise<string | undefined>",
      "inputDescription": "The native dialog capability plus the current trusted parent window, if one exists.",
      "outputDescription": "A native-selected path or cancellation, never renderer input.",
      "errors": [
        {
          "code": "NATIVE_DIALOG_FAILED",
          "retryability": "safe",
          "description": "The operating-system file dialog failed."
        }
      ],
      "invariants": [
        "Selection is restricted to one file and no path crosses renderer IPC."
      ],
      "validationBoundary": "src/main/local-firmware-target-picker.ts#LocalFirmwareManifestDialog.chooseManifest owns the exact declared call boundary; referenced runtime validators apply before untrusted values are used.",
      "tests": [
        "tests/local-firmware-target-picker.test.ts"
      ]
    },
    {
      "capabilityId": "picker-select-local-target",
      "sourceModule": "src/main/local-firmware-target-picker.ts",
      "symbol": "LocalFirmwareTargetPicker",
      "symbolKind": "class",
      "sourceMember": "selectLocalFirmwareTarget",
      "sourceSignature": "selectLocalFirmwareTarget(): Promise<LocalFirmwareTargetSelection | undefined>",
      "argumentsSignature": "readonly []",
      "returnSignature": "Promise<LocalFirmwareTargetSelection | undefined>",
      "inputDescription": "The main-process picker adapter.",
      "outputDescription": "A validated target/descriptor-opening artifact pair or cancellation.",
      "errors": [
        {
          "code": "ARTIFACT_REJECTED",
          "retryability": "never",
          "description": "The chosen manifest or artifact failed strict admission."
        }
      ],
      "invariants": [
        "The selection binds target and manifest identities to an openVerified descriptor capability; neither the selected nor app-owned path crosses renderer IPC."
      ],
      "validationBoundary": "src/main/local-firmware-target-picker.ts#LocalFirmwareTargetPicker.selectLocalFirmwareTarget owns the exact declared call boundary; referenced runtime validators apply before untrusted values are used.",
      "tests": [
        "tests/local-firmware-target-picker.test.ts"
      ]
    },
    {
      "capabilityId": "picker-reopen-local-target",
      "sourceModule": "src/main/local-firmware-target-picker.ts",
      "symbol": "LocalFirmwareTargetPicker",
      "symbolKind": "class",
      "sourceMember": "reopenLocalFirmwareTarget",
      "sourceSignature": "reopenLocalFirmwareTarget(target: LocalCustomFirmwareTarget): Promise<LocalFirmwareTargetSelection>",
      "argumentsSignature": "readonly [target: LocalCustomFirmwareTarget]",
      "returnSignature": "Promise<LocalFirmwareTargetSelection>",
      "inputDescription": "A recovered strict custom target.",
      "outputDescription": "A rebound target/artifact capability from deterministic app-owned paths.",
      "errors": [
        {
          "code": "ARTIFACT_REJECTED",
          "retryability": "never",
          "description": "App-owned files no longer reproduce the persisted target."
        }
      ],
      "invariants": [
        "Recovery never trusts a persisted arbitrary filesystem path."
      ],
      "validationBoundary": "src/main/local-firmware-target-picker.ts#LocalFirmwareTargetPicker.reopenLocalFirmwareTarget owns the exact declared call boundary; referenced runtime validators apply before untrusted values are used.",
      "tests": [
        "tests/local-firmware-target-picker.test.ts"
      ]
    }
  ],
  "structuralCapabilities": [],
  "compositions": [],
  "sourceOfTruth": [
    "src/main/local-firmware-target-picker.ts",
    "src/core/local-firmware-build.ts",
    "src/core/contracts.ts",
    "src/application/flasher-application.ts"
  ]
}
